{
  "$schema": "../schemas/contribution-v1.schema.json",
  "format": "drop7-contribution-v1",
  "contributionId": "CT-20260820T100250Z-ad74d340",
  "actor": {
    "kind": "model",
    "platform": "claude-code",
    "model": "claude-opus-5[1m]",
    "agentId": "delegated/engine-fidelity-audit"
  },
  "level": "L2",
  "roles": [
    {
      "role": "validation",
      "degree": "lead"
    },
    {
      "role": "investigation",
      "degree": "substantial"
    }
  ],
  "summary": "Independently audited the native and TypeScript rules engines against the reference implementation the repository itself cites, identifying two one-sided rise-boundary scoring divergences, a wrong opening position, and a recoverable-seed information-boundary hole, while confirming clear rules, wave depth accounting, gravity, reveal mechanics, RNG domain separation and native/TypeScript parity as correct.",
  "theoryIds": [],
  "experimentIds": [],
  "runIds": [],
  "artifactPaths": [
    "docs/exploratory/audit-01-engine-fidelity.md"
  ],
  "commitShas": [],
  "validationPerformed": [
    "Ran npm test: 122 tests passed.",
    "Ran make test-native CXX=clang++: gradient check, ntuple self-tests and fair-depth4 self-test all passed.",
    "Ran npm run parity: 256 seeds, 6852 moves, exact.",
    "Chi-squared tests on 10M disc draws and a 2^32 exhaustive seed-recovery experiment."
  ],
  "limitations": [
    "Not yet independently reviewed.",
    "Recorded by the coordinator on the delegated agent's behalf; the agent had no write access to research/ and did not review this transcription.",
    "Read-only audit; no cohort opened and no candidate repaired."
  ],
  "selfReported": false,
  "reviewedBy": null,
  "recordedAt": "2026-08-20T10:02:50Z"
}
