{
  "$schema": "../schemas/contribution-v1.schema.json",
  "format": "drop7-contribution-v1",
  "contributionId": "CT-20260823T215412Z-e59c1b8c",
  "actor": {
    "kind": "model",
    "platform": "OpenCode",
    "model": "baseten/moonshotai/Kimi-K3",
    "agentId": null
  },
  "level": "L2",
  "roles": [
    {
      "role": "methodology",
      "degree": "lead"
    }
  ],
  "summary": "P-SOL-v2 correction (runs/RUN-20260823T191900Z-b9f8f80d/kimi-k3-psol-v2-correction.md) after the S1 halt exposed the v1 erratum (D3 N7M6 priced at the D3 N5M1 throughput, 20-77x underpriced): rejected the small-native-reference and M1-only-reference options with explicit power arguments, designed the two-rung ladder (1,200 seed-free roots against a fast-d3s7 proxy, powered; 6-root native D3 N7M6 guardrail with honest kill-power statement), switched corpus continuations to the fast engine, re-derived every budget line at 6.83 CPU-s/move with a preregistered reserve, restated M3's evidential status, updated P(G0) to ~0.5-0.55, and recommended registering the fast-engine M=6 port as parallel non-blocking engineering with a rung-2 upgrade contingency.",
  "theoryIds": [
    "TH-20260823-sibling-outcome-labels-fix-leaf-0c3d480d"
  ],
  "experimentIds": [
    "EX-20260823-sol-corpus-and-offline-gate-v2-f95f56e4"
  ],
  "runIds": [],
  "artifactPaths": [
    "runs/RUN-20260823T091530Z-cbe65468/kimi-k3-theory-design.md"
  ],
  "commitShas": [],
  "validationPerformed": [
    "Read-only design session; no file modified, no build, no seed read"
  ],
  "limitations": [
    "Self-reported contribution; not yet independently reviewed."
  ],
  "selfReported": true,
  "reviewedBy": null,
  "recordedAt": "2026-08-23T21:54:12Z"
}
