{
  "$schema": "../schemas/contribution-v1.schema.json",
  "format": "drop7-contribution-v1",
  "contributionId": "CT-20260821T084147Z-9abdbf99",
  "actor": {
    "kind": "model",
    "platform": "Claude Code",
    "model": "claude-opus-5[1m]",
    "agentId": null
  },
  "level": "L2",
  "roles": [
    {
      "role": "writing",
      "degree": "substantial"
    }
  ],
  "summary": "Rewrote the value-policy-learning family page and hand-wrote six approach pages for the research console: chance-state-nnue, conservative-fitted-policy-iteration, d4-q-clone, denoised-value, direct-policy, and dqn. Each page follows the four-altitude approach-page template, quotes only numbers that exist in a retained record with their source and evidence label (ledger-recorded vs task-record only), states 'no retained result' where that is the truth, and carries the audit-03/audit-04 caveats about scoring mode and unrecoverable rejections. No research record, protocol, or source file was modified and no experiment was run.",
  "theoryIds": [],
  "experimentIds": [],
  "runIds": [],
  "artifactPaths": [
    "approaches/value-policy-learning/README.mdx",
    "approaches/value-policy-learning/chance-state-nnue/README.mdx",
    "approaches/value-policy-learning/conservative-fitted-policy-iteration/README.mdx",
    "approaches/value-policy-learning/d4-q-clone/README.mdx",
    "approaches/value-policy-learning/denoised-value/README.mdx",
    "approaches/value-policy-learning/direct-policy/README.mdx",
    "approaches/value-policy-learning/dqn/README.mdx"
  ],
  "commitShas": [],
  "validationPerformed": [
    "node web/scripts/check-mdx.mjs passes for the written pages"
  ],
  "limitations": [
    "Self-reported contribution; not yet independently reviewed."
  ],
  "selfReported": true,
  "reviewedBy": null,
  "recordedAt": "2026-08-21T08:41:47Z"
}
