{
  "$schema": "../schemas/contribution-v1.schema.json",
  "format": "drop7-contribution-v1",
  "contributionId": "CT-20260821T062610Z-3d764fd5",
  "actor": {
    "kind": "model",
    "platform": "Claude Code",
    "model": "claude-fable-5",
    "agentId": null
  },
  "level": "L2",
  "roles": [
    {
      "role": "visualization",
      "degree": "substantial"
    }
  ],
  "summary": "Wrote the visual explainer page for the semantics-preserving fast engine (approaches/lifetime-objective/fast-engine/README.mdx) and the reusable SVG figure components behind it (web/components/Engine.tsx: bitboard scan, run-length lookup, engine-generated cascade animation, move pipeline, tree shape, attribution bar, speedup bars, packed key, gate ladder, batch layout, future-work ladder). Enabled GFM tables in the MDX renderer and exported CellGlyph from Board.tsx. Every figure value is copied from docs/exploratory/finding-13-fast-engine.md; the cascade frames were generated by the TypeScript engine in latent mode. Added docs/agents/project-nature.md, a domain glossary for agents and automated reviewers, linked from AGENTS.md. No research run, seed, or scientific conclusion was touched.",
  "theoryIds": [],
  "experimentIds": [],
  "runIds": [],
  "artifactPaths": [
    "approaches/lifetime-objective/fast-engine/README.mdx",
    "web/components/Engine.tsx",
    "docs/agents/project-nature.md"
  ],
  "commitShas": [],
  "validationPerformed": [
    "npm test (134 pass); cd web && npx tsc --noEmit; cd web && npm run build; cd web && npx eslint on changed components; rendered /approaches/lifetime-objective/fast-engine via next start and curl"
  ],
  "limitations": [
    "Self-reported contribution; not yet independently reviewed."
  ],
  "selfReported": true,
  "reviewedBy": null,
  "recordedAt": "2026-08-21T06:26:10Z"
}
